{
  "record_type": "yarn",
  "yarn_id": "YRN00027",
  "brand": "DROPS",
  "product": "DROPS Nepal",
  "variant": null,
  "cyc_weight": null,
  "package_mass_g": 50.0,
  "package_length_m": 75.0,
  "fibre_composition": {
    "Wool": 65.0,
    "Alpaca": 35.0
  },
  "tex": 666.6666666666666,
  "nominal_diameter_mm": null,
  "wpi": null,
  "recommended_needle_min_mm": null,
  "recommended_needle_max_mm": null,
  "source_type": "official_web_seed",
  "source_reference": "https://www.garnstudio.com/pricelist.php?action=yarns&cid=19",
  "evidence_level": "catalogue_listing"
}
