{
  "record_type": "yarn",
  "yarn_id": "DROPS_ANDES_100G_90M",
  "brand": "DROPS",
  "product": "Andes",
  "variant": null,
  "cyc_weight": 6,
  "package_mass_g": 100,
  "package_length_m": 90,
  "fibre_composition": {
    "Wool": 65,
    "Alpaca": 35
  },
  "tex": 1111.111,
  "nominal_diameter_mm": null,
  "wpi": null,
  "recommended_needle_min_mm": null,
  "recommended_needle_max_mm": null,
  "source_type": "manufacturer_web",
  "source_reference": "https://www.garnstudio.com/yarn.php?show=drops-andes&cid=17",
  "evidence_level": "manufacturer_declared"
}