{
  "record_type": "yarn",
  "yarn_id": "YRN00073",
  "brand": "Scheepjes",
  "product": "Woolwise",
  "variant": null,
  "cyc_weight": 3,
  "package_mass_g": 100.0,
  "package_length_m": 200.0,
  "fibre_composition": {
    "Recycled Superwash Merino Wool": 100.0
  },
  "tex": 500.0,
  "nominal_diameter_mm": null,
  "wpi": null,
  "recommended_needle_min_mm": 4.0,
  "recommended_needle_max_mm": 4.0,
  "source_type": "official_web_seed",
  "source_reference": "https://www.scheepjes.com/en/woolwise-13275/page-2/",
  "evidence_level": "manufacturer_official_page"
}
