{
  "record_type": "yarn",
  "yarn_id": "YRN00234",
  "brand": "King Cole",
  "product": "Fashion Aran 100",
  "variant": null,
  "cyc_weight": 4,
  "package_mass_g": 100.0,
  "package_length_m": 200.0,
  "fibre_composition": {
    "Acrylic": 70.0,
    "Wool": 30.0
  },
  "tex": 500.0,
  "nominal_diameter_mm": null,
  "wpi": null,
  "recommended_needle_min_mm": 5.0,
  "recommended_needle_max_mm": 5.0,
  "source_type": "official_web_seed",
  "source_reference": "https://www.kingcole.com/product/fashion-aran-100/",
  "evidence_level": "manufacturer_official_page"
}
