{
  "record_type": "yarn",
  "yarn_id": "PASCUALI_CASHMERE_6_28_25G_112M",
  "brand": "Pascuali",
  "product": "Cashmere 6/28",
  "variant": null,
  "cyc_weight": null,
  "package_mass_g": 25,
  "package_length_m": 112,
  "fibre_composition": {"Cashmere wool": 100},
  "tex": 223.214,
  "nominal_diameter_mm": null,
  "wpi": null,
  "recommended_needle_min_mm": null,
  "recommended_needle_max_mm": null,
  "source_type": "manufacturer_web",
  "source_reference": "https://www.pascuali.de/en-us/products/28-100-cashmere-yarn-21-colours?Currency=GBP",
  "evidence_level": "manufacturer_declared"
}