{
  "record_type": "yarn",
  "yarn_id": "YRN00011",
  "brand": "DROPS",
  "product": "DROPS Cotton Light",
  "variant": null,
  "cyc_weight": null,
  "package_mass_g": 50.0,
  "package_length_m": 105.0,
  "fibre_composition": {
    "Cotton": 50.0,
    "Polyester": 50.0
  },
  "tex": 476.1904761904762,
  "nominal_diameter_mm": null,
  "wpi": null,
  "recommended_needle_min_mm": null,
  "recommended_needle_max_mm": null,
  "source_type": "official_web_seed",
  "source_reference": "https://www.garnstudio.com/pricelist.php?action=yarns&cid=19",
  "evidence_level": "catalogue_listing"
}
