{
  "record_type": "yarn",
  "yarn_id": "YRN00281",
  "brand": "Malabrigo",
  "product": "Seis Cabos",
  "variant": null,
  "cyc_weight": 3,
  "package_mass_g": 100.0,
  "package_length_m": 200.0,
  "fibre_composition": {
    "Super Fine Merino Wool": 100.0
  },
  "tex": 500.0,
  "nominal_diameter_mm": null,
  "wpi": null,
  "recommended_needle_min_mm": 4.5,
  "recommended_needle_max_mm": 4.5,
  "source_type": "official_web_seed",
  "source_reference": "https://malabrigoyarn.com/yarns/seis-cabos",
  "evidence_level": "manufacturer_official_page"
}
