{
  "record_type": "yarn",
  "yarn_id": "YRN00028",
  "brand": "DROPS",
  "product": "DROPS Nord",
  "variant": null,
  "cyc_weight": null,
  "package_mass_g": 50.0,
  "package_length_m": 170.0,
  "fibre_composition": {
    "Alpaca": 45.0,
    "Nylon": 30.0,
    "Wool": 25.0
  },
  "tex": 294.11764705882354,
  "nominal_diameter_mm": null,
  "wpi": null,
  "recommended_needle_min_mm": null,
  "recommended_needle_max_mm": null,
  "source_type": "official_web_seed",
  "source_reference": "https://www.garnstudio.com/pricelist.php?action=yarns&cid=19",
  "evidence_level": "catalogue_listing"
}
