{
  "record_type": "yarn",
  "yarn_id": "YRN00193",
  "brand": "King Cole",
  "product": "Little Lamb DK",
  "variant": null,
  "cyc_weight": 3,
  "package_mass_g": 50.0,
  "package_length_m": 120.0,
  "fibre_composition": {
    "Extra Fine Merino Wool": 60.0,
    "Cashmere Effect Polyamide": 40.0
  },
  "tex": 416.6666666666667,
  "nominal_diameter_mm": null,
  "wpi": null,
  "recommended_needle_min_mm": 4.0,
  "recommended_needle_max_mm": 4.0,
  "source_type": "official_web_seed",
  "source_reference": "https://www.kingcole.com/product/little-lamb-dk/",
  "evidence_level": "manufacturer_official_page"
}
