{
  "record_type": "yarn",
  "yarn_id": "YRN00050",
  "brand": "Scheepjes",
  "product": "Catona 100g",
  "variant": null,
  "cyc_weight": 1,
  "package_mass_g": 100.0,
  "package_length_m": 250.0,
  "fibre_composition": {
    "Mercerised Cotton": 100.0
  },
  "tex": 400.0,
  "nominal_diameter_mm": null,
  "wpi": null,
  "recommended_needle_min_mm": 2.5,
  "recommended_needle_max_mm": 2.5,
  "source_type": "official_web_seed",
  "source_reference": "https://www.scheepjes.com/en/catona-100g-767/",
  "evidence_level": "manufacturer_official_page"
}
