{
  "record_type": "yarn",
  "yarn_id": "PASCUALI_CAMEL_DK_25G_80M",
  "brand": "Pascuali",
  "product": "Camel DK",
  "variant": null,
  "cyc_weight": 3,
  "package_mass_g": 25,
  "package_length_m": 80,
  "fibre_composition": {"Camel wool": 100},
  "tex": 312.5,
  "nominal_diameter_mm": null,
  "wpi": null,
  "recommended_needle_min_mm": 4.5,
  "recommended_needle_max_mm": 4.5,
  "source_type": "manufacturer_web",
  "source_reference": "https://www.pascuali.de/en-uk/pages/camel-dk",
  "evidence_level": "manufacturer_declared"
}