{
  "record_type": "yarn",
  "yarn_id": "PAINTBOX_SIMPLY_DK_100G_276M",
  "brand": "Paintbox Yarns",
  "product": "Simply DK",
  "variant": null,
  "cyc_weight": 3,
  "package_mass_g": 100,
  "package_length_m": 276,
  "fibre_composition": {
    "Acrylic": 100
  },
  "tex": 362.319,
  "nominal_diameter_mm": null,
  "wpi": null,
  "recommended_needle_min_mm": null,
  "recommended_needle_max_mm": null,
  "source_type": "manufacturer_web",
  "source_reference": "https://www.paintboxyarns.com/yarns/simply-dk/",
  "evidence_level": "manufacturer_declared"
}