{
  "record_type": "yarn",
  "yarn_id": "YRN00045",
  "brand": "Scheepjes",
  "product": "Big Darling",
  "variant": null,
  "cyc_weight": 6,
  "package_mass_g": 150.0,
  "package_length_m": 90.0,
  "fibre_composition": {
    "Polyester": 100.0
  },
  "tex": 1666.6666666666667,
  "nominal_diameter_mm": null,
  "wpi": null,
  "recommended_needle_min_mm": 8.0,
  "recommended_needle_max_mm": 8.0,
  "source_type": "official_web_seed",
  "source_reference": "https://www.scheepjes.com/en/big-darling-14001/",
  "evidence_level": "manufacturer_official_page"
}
