{
  "record_type": "yarn",
  "yarn_id": "PASCUALI_PUNO_50G_200M",
  "brand": "Pascuali",
  "product": "Puno",
  "variant": null,
  "cyc_weight": null,
  "package_mass_g": 50,
  "package_length_m": 200,
  "fibre_composition": {"Organic cotton": 70, "Alpaca wool": 30},
  "tex": 250.0,
  "nominal_diameter_mm": null,
  "wpi": null,
  "recommended_needle_min_mm": 2.5,
  "recommended_needle_max_mm": 2.5,
  "source_type": "manufacturer_web",
  "source_reference": "https://www.pascuali.de/en-uk/products/pascuali-puno",
  "evidence_level": "manufacturer_declared"
}