{
  "record_type": "yarn",
  "yarn_id": "YRN00287",
  "brand": "Malabrigo",
  "product": "Arroyo",
  "variant": null,
  "cyc_weight": 2,
  "package_mass_g": 100.0,
  "package_length_m": 306.0,
  "fibre_composition": {
    "Superwash Merino Wool": 100.0
  },
  "tex": 326.797385620915,
  "nominal_diameter_mm": null,
  "wpi": null,
  "recommended_needle_min_mm": 3.75,
  "recommended_needle_max_mm": 3.75,
  "source_type": "official_web_seed",
  "source_reference": "https://malabrigoyarn.com/yarns/arroyo",
  "evidence_level": "manufacturer_official_page"
}
