{
  "record_type": "yarn",
  "yarn_id": "LION_BRAND_24_7_COTTON_100G_170M",
  "brand": "Lion Brand",
  "product": "24/7 Cotton",
  "variant": null,
  "cyc_weight": 4,
  "package_mass_g": 100,
  "package_length_m": 170,
  "fibre_composition": {"Mercerised cotton": 100},
  "tex": 588.235,
  "nominal_diameter_mm": null,
  "wpi": null,
  "recommended_needle_min_mm": null,
  "recommended_needle_max_mm": null,
  "source_type": "manufacturer_web",
  "source_reference": "https://www.lionbrand.com/community/blog/get-know-247-cotton/",
  "evidence_level": "manufacturer_declared"
}