{
  "record_type": "yarn",
  "yarn_id": "YRN00160",
  "brand": "Sirdar",
  "product": "Soft Down",
  "variant": null,
  "cyc_weight": 3,
  "package_mass_g": 100.0,
  "package_length_m": 343.0,
  "fibre_composition": {
    "Wool": 20.0,
    "Acrylic": 80.0
  },
  "tex": 291.5451895043732,
  "nominal_diameter_mm": null,
  "wpi": null,
  "recommended_needle_min_mm": 4.0,
  "recommended_needle_max_mm": 4.0,
  "source_type": "official_web_seed",
  "source_reference": "https://sirdar.com/en/products/sirdar-soft-down-100g",
  "evidence_level": "manufacturer_official_page"
}
