{
  "record_type": "yarn",
  "yarn_id": "YRN00154",
  "brand": "Sirdar",
  "product": "Country Classic 4 Ply",
  "variant": null,
  "cyc_weight": 1,
  "package_mass_g": 50.0,
  "package_length_m": 200.0,
  "fibre_composition": {
    "Merino Wool": 50.0,
    "Acrylic": 50.0
  },
  "tex": 250.0,
  "nominal_diameter_mm": null,
  "wpi": null,
  "recommended_needle_min_mm": 3.25,
  "recommended_needle_max_mm": 3.25,
  "source_type": "official_web_seed",
  "source_reference": "https://sirdar.com/en/products/sirdar-country-classic-4-ply-50g",
  "evidence_level": "manufacturer_official_page"
}
