{
  "record_type": "yarn",
  "yarn_id": "YRN00285",
  "brand": "Malabrigo",
  "product": "Caprino",
  "variant": null,
  "cyc_weight": 2,
  "package_mass_g": 50.0,
  "package_length_m": 150.0,
  "fibre_composition": {
    "Super Fine Merino Wool": 80.0,
    "Cashmere": 20.0
  },
  "tex": 333.3333333333333,
  "nominal_diameter_mm": null,
  "wpi": null,
  "recommended_needle_min_mm": 3.75,
  "recommended_needle_max_mm": 3.75,
  "source_type": "official_web_seed",
  "source_reference": "https://malabrigoyarn.com/yarns/caprino",
  "evidence_level": "manufacturer_official_page"
}
