{
  "record_type": "yarn",
  "yarn_id": "CARON_SIMPLY_SOFT_170G_288M",
  "brand": "Caron",
  "product": "Simply Soft",
  "variant": null,
  "cyc_weight": 4,
  "package_mass_g": 170,
  "package_length_m": 288,
  "fibre_composition": {
    "Acrylic": 100
  },
  "tex": 590.278,
  "nominal_diameter_mm": null,
  "wpi": null,
  "recommended_needle_min_mm": null,
  "recommended_needle_max_mm": null,
  "source_type": "manufacturer_web",
  "source_reference": "https://caronofficial.com/caron-simply-soft-yarn/",
  "evidence_level": "manufacturer_declared"
}