{
  "record_type": "yarn",
  "yarn_id": "YRN00190",
  "brand": "King Cole",
  "product": "Dazzle DK",
  "variant": null,
  "cyc_weight": 3,
  "package_mass_g": 100.0,
  "package_length_m": 250.0,
  "fibre_composition": {
    "Acrylic": 91.0,
    "Sequin": 9.0
  },
  "tex": 400.0,
  "nominal_diameter_mm": null,
  "wpi": null,
  "recommended_needle_min_mm": 4.0,
  "recommended_needle_max_mm": 4.0,
  "source_type": "official_web_seed",
  "source_reference": "https://www.kingcole.com/product/dazzle-dk/",
  "evidence_level": "manufacturer_official_page"
}
