{
  "record_type": "yarn",
  "yarn_id": "YRN00292",
  "brand": "Malabrigo",
  "product": "Mechita",
  "variant": null,
  "cyc_weight": 1,
  "package_mass_g": 100.0,
  "package_length_m": 384.0,
  "fibre_composition": {
    "Superwash Merino Wool": 100.0
  },
  "tex": 260.4166666666667,
  "nominal_diameter_mm": null,
  "wpi": null,
  "recommended_needle_min_mm": 2.5,
  "recommended_needle_max_mm": 2.5,
  "source_type": "official_web_seed",
  "source_reference": "https://malabrigoyarn.com/yarns/mechita",
  "evidence_level": "manufacturer_official_page"
}
